Four-character Idiom,Hanja,the Korean Definition,Choice1,Choice2,Choice3,Choice4,,,
은거방언,隱居放言,은거하여 살면서 마음속에 품고 있는 생각을 털어놓음. 논어 미자편에 보임.,隱,殷,遁,臀,,,
익자삼우,益者三友,"사귀어서 자기에게 도움이 되는 세 가지의 벗. 심성이 곧은 사람, 믿음직한 사람, 문견이 많은 사람. 논어 계씨편에 보임.",益,翌,加,袈,,,
인생삼락,人生三樂,"인생의 세 가지 즐거움. 사람으로 탱난 것, 사내로 태어난 것, 장수하는 것.",人,咽,慈,炙,,,
일국삼공,一國三公,한 나라에 세 임금. 많은 사람들이 저마다 구구한 의견을 제시함을 비유한 말.,一,溢,恨,罕,,,
일사천리,一瀉千里,강물이 빨리 흘러 천 리를 감. 어떤 일이 거침없이 빨리 진행됨.,一,溢,恨,罕,,,
일이관지,一以貫之,하나의 방법이나 태도로써 처음부터 끝까지 한결같음. 논어 이인편에 보임.,一,溢,恨,罕,,,
일일삼추,一日三秋,하루가 삼 년 같음. 몹시 애태우며 기다림. 시경 왕풍의 시 채갈에 보임.,一,溢,恨,罕,,,
일일천리,一日千里,하루에 천 리를 달림. 말이 매우 빨리 달림. 발전하는 속도가 빠름. 물의 흐름이 빠름.,一,溢,恨,罕,,,
일자천금,一字千金,"글자 하나의 값이 천금의 가치가 있음. 글씨나 문장이 아주 훌륭함. 진나라의 여불위가 식객들을 동원해 백과사전격인 여씨춘추를 완성하고, 이 책에 대한 강한 자부심의 표현으로, 수도인 함양 성문에 걸어놓고, 누구든지 한 글자라도 더하거나 뺀다면 천금을 주겠다고 한 데서 유래.",一,溢,恨,罕,,,
일장일단,一長一短,일면의 장점과 다른 일면의 단점을 통틀어 이름.,一,溢,恨,罕,,,
작심삼일,作心三日,단단히 먹은 마음이 사흘을 가지 못함. 결심이 굳지 못함.,作,勺,製,悌,,,
적자지심,赤子之心,적자의 마음. 죄악에 물들지 아니하고 순수하며 거짓이 없는 마음. 맹자 이루 하편에 보임.,赤,炙,丹,緞,,,
절장보단,絶長補短,긴 것을 잘라서 짧은 것을 보충함. 장점이나 넉넉한 것으로 단점이나 부족한 것을 보충함.,絶,截,斷,緞,,,
조명시리,朝名市利,명예는 조정에서 다투고 이익은 시장에서 다툼. 무슨 일이든 알맞은 곳에서 하여야 함.,朝,粗,旦,緞,,,
중과부적,衆寡不敵,적은 수효로 많은 수효를 대적하지 못함.,衆,仲,群,窘,,,
청천백일,靑天白日,하늘이 맑게 갠 대낮. 맑은 하늘에 뜬 해. 혐의나 원죄가 풀리어 무죄가 됨.,靑,廳,綠,麓,,,
청출어람,靑出於藍,쪽에서 뽑아낸 푸른 물감이 쪽보다 더 푸름. 제자나 후배가 스승보다 선배보다 나음.,靑,廳,綠,麓,,,
청풍명월,淸風明月,맑은 바람과 밝은 달.,淸,廳,澹,痰,,,
초미지급,焦眉之急,눈썹에 불이 붙은 상황처럼 매우 급함.,焦,梢,馮,憑,,,
타초경사,打草驚蛇,풀을 두들겨서 뱀을 놀라게 함. 불필요하게 상대방을 자극함.,打,惰,擊,膈,,,
필부지용,匹夫之勇,깊은 생각 없이 혈기만 믿고 함부로 부리는 소인의 용기.,匹,泌,侶,濾,,,
항룡유회,亢龍有悔,하늘 끝까지 다다른 용이 내려갈 길 밖에 없음을 후회함. 부귀영화가 극도에 다다른 사람은 쇠락할 염려가 있음. 욕심에 한계가 없으면 반드시 후회하게 됨.,亢,降,高,痼,,,
혼정신성,昏定晨省,밤에는 부모의 잠자리를 보아 드리고 이른 아침에는 부모의 밤새 안부를 여쭘. 부모를 잘 섬기고 효성을 다함.,昏,渾,昧,邁,,,
화씨지벽,和氏之璧,화씨의 구슬. 천하의 귀중한 보배. 뛰어난 인재.,和,樺,旼,悶,,,
